{
  "schema_version": "0.1.0-experimental",
  "subject": {
    "sha256": "86a3634db5fbdd88527a8d7316a7133d2ec27edd05be1dcaa81bf574bfbe765b",
    "size_bytes": 2048,
    "format": "PE"
  },
  "producer": {
    "component": "rel-ex01-fixture",
    "version": "0.1.0",
    "backend": "synthetic-bytes",
    "backend_version": "0.1.0",
    "config_sha256": "aaaaaaaaaaaaaaaaaaaaaaaaaaaaaaaaaaaaaaaaaaaaaaaaaaaaaaaaaaaaaaaa",
    "run_id": "bbbbbbbbbbbbbbbbbbbbbbbbbbbbbbbbbbbbbbbbbbbbbbbbbbbbbbbbbbbbbbbb"
  },
  "scope": {
    "domain": "pe.dos_magic",
    "status": "complete",
    "procedure": "Inspect two bytes at offset 0 of the synthetic PE32 fixture.",
    "limitations": [
      "DOS signature only; no inference about imports, runtime, or network behavior."
    ]
  },
  "observations": [
    {
      "id": "dos-value",
      "predicate": "equals.MZ",
      "status": "present",
      "raw_value": "MZ",
      "normalized_value": "MZ",
      "evidence_ids": [
        "mz-sig"
      ]
    }
  ],
  "evidence": [
    {
      "id": "mz-sig",
      "subject_sha256": "86a3634db5fbdd88527a8d7316a7133d2ec27edd05be1dcaa81bf574bfbe765b",
      "location": {
        "kind": "file_offset",
        "start": 0,
        "length": 2
      },
      "method": "direct-byte-inspection",
      "extractor_version": "0.1.0"
    }
  ],
  "diagnostics": []
}
